{
  "version": 1,
  "brand": "PEP",
  "domain": "pep-drink.com",
  "oneLiner": "Premium light protein drink for social, out-of-home moments.",
  "positioningStatement": "PEP is the drink you order at a café or terrace when you want something light and refreshing with a protein boost — not a gym shake or energy drink.",
  "audience": ["health-conscious social drinkers", "café and bar guests", "venue operators"],
  "occasions": ["morning brunch", "terrace", "post-workout social", "evening social"],
  "personalityAdjectives": ["light", "refreshing", "premium", "warm", "feel-good"],
  "voice": {
    "tone": "inviting, confident, never gym-bro or childish",
    "tagline": "Feel good. Have fun.",
    "avoidWords": ["shred", "fuel", "beast mode", "gut-friendly energy"]
  },
  "visual": {
    "mood": "warm, airy, unhurried; premium but approachable",
    "photography": "product in real social settings; natural light",
    "rejectLooks": ["neon club seltzer", "black/yellow gym", "meal-replacement grey minimalism"]
  },
  "inLineBrands": [
    {
      "name": "Example",
      "url": "https://example.com",
      "why": "Social premium beverage tone",
      "adjectives": ["light", "premium"],
      "designPatterns": ["flavour-forward cards"]
    }
  ],
  "antiReferences": [
    {
      "name": "Lean Body RTD",
      "why": "Gym-first imagery and audience"
    },
    {
      "name": "drinkpep.com",
      "why": "Name collision — US energy/probiotic; layout-only if at all"
    }
  ],
  "layoutOnlyReferences": [
    {
      "name": "Revized",
      "url": "https://www.revized-seltzer.com/",
      "patterns": ["flavour grid", "serving ritual", "clean hero"]
    }
  ],
  "brandFitRules": [
    "Protein is a benefit, not the whole identity",
    "Occasions are out-of-home and social first",
    "Visual warmth over clinical nutrition"
  ]
}
